{
  "schema_version": 1,
  "asset_id": "icon",
  "kind": "image",
  "brief": "A readable health-pickup icon for a flat illustrated game interface.",
  "requirements": [
    {
      "id": "identity",
      "text": "Use a white medical cross on a red rounded-square badge.",
      "category": "identity",
      "priority": "must"
    },
    {
      "id": "readability",
      "text": "Keep one strong silhouette without lettering or tiny ornaments.",
      "category": "appearance",
      "priority": "must"
    },
    {
      "id": "size",
      "text": "The icon must remain distinguishable at 32 by 32 pixels.",
      "category": "technical",
      "priority": "must"
    }
  ],
  "references": []
}
