{
  "schema_version": 1,
  "asset_id": "impact",
  "kind": "sound_effect",
  "brief": "One short, dry metal impact for a crate landing on concrete.",
  "requirements": [
    {
      "id": "event",
      "text": "A single impact followed by a brief metallic rattle.",
      "category": "identity",
      "priority": "must"
    },
    {
      "id": "isolation",
      "text": "No voices, music or ambient background.",
      "category": "appearance",
      "priority": "must"
    },
    {
      "id": "timing",
      "text": "The audible impact must align with the landing event.",
      "category": "technical",
      "priority": "must"
    }
  ],
  "references": []
}
